{
  "$schema": "http://json-schema.org/draft-07/schema#",
  "title": "RepoFeeConfiguration",
  "type": "object",
  "required": ["arancelCaucionColocadora","arancelCaucionTomadora","derechosDeMercadoDailyRate","gastosGarantiaDailyRate","ivaRepoRate"],
  "properties": {
    "arancelCaucionColocadora": {
      "type": "object",
      "properties": {"ARS": {"type":"number"}, "USD": {"type":"number"}}
    },
    "arancelCaucionTomadora": {
      "type": "object",
      "properties": {"ARS": {"type":"number"}, "USD": {"type":"number"}}
    },
    "derechosDeMercadoDailyRate": {
      "type": "object",
      "properties": {"ARS": {"type":"number"}, "USD": {"type":"number"}}
    },
    "gastosGarantiaDailyRate": {
      "type": "object",
      "properties": {"ARS": {"type":"number"}, "USD": {"type":"number"}}
    },
    "ivaRepoRate": {"type":"number"},
    "overridesMetadata": {
      "type": "array",
      "items": {"type":"object","properties":{"currency":{"type":"string"},"role":{"type":"string"},"previousValue":{"type":"number"},"effectiveDate":{"type":"string","format":"date-time"}}}
    }
  }
}
